{
  "schema_version": 7,
  "report": "pack-status",
  "entries": [
    {
      "pack": "example-pack",
      "pack_version": "3.0.0",
      "surface": "claude",
      "intent": {
        "state": "known",
        "active": true,
        "revision": 1,
        "version": "3.0.0",
        "selection": {
          "mode": "custom",
          "roots": [
            {
              "kind": "skill",
              "id": "ask-matt"
            }
          ]
        },
        "provider_choices": []
      },
      "update_available": false,
      "latest_attempt": {
        "outcome": "verified",
        "plan_id": "plan-example"
      },
      "projection_summary": {
        "verified": 1,
        "missing": 0,
        "drifted": 0,
        "ambiguous": 0,
        "unmanaged": 0
      },
      "projection_details": [
        {
          "id": "skill:example",
          "target": "$HOME/.claude/skills/example",
          "owner": "example-pack",
          "health": "verified",
          "observed_fingerprint": "sha256:example",
          "desired_fingerprint": "sha256:example",
          "contributors": [
            "pack:example-pack:skill:ask-matt"
          ]
        }
      ],
      "contract": {
        "compatibility": "complete",
        "logical_resource_counts": {
          "Skills": 1,
          "Instructions": 0,
          "MCPServers": 0,
          "Lifecycles": 0,
          "Agents": 0,
          "Commands": 0,
          "Assets": 0,
          "Notices": 0
        },
        "dependency_closure": [],
        "bindings": [],
        "exclusions": [],
        "optional_modes": [],
        "prompt_authorities": [],
        "aliases": [],
        "authority_disclosure": "Activation grants only sealed actions.",
        "resource_graph": {
          "resources": []
        },
        "selection_validity": {
          "all": {
            "available": true,
            "reasons": [],
            "optional_exclusions": []
          },
          "roots": []
        }
      },
      "readiness": {
        "configured": {
          "state": "known",
          "value": true
        },
        "authorized": {
          "state": "unknown",
          "value": null
        },
        "usable": {
          "state": "unknown",
          "value": null
        }
      },
      "blockers": [],
      "evidence": [
        "static projection inspected"
      ],
      "pending_human_actions": [
        "supply explicit runtime loading evidence"
      ],
      "optional_authorities": [
        {
          "mode_id": "browser-network",
          "authority": "browser",
          "state": "unknown",
          "fallback": "static evidence-only analysis"
        },
        {
          "mode_id": "browser-network",
          "authority": "network",
          "state": "available",
          "fallback": "static evidence-only analysis"
        }
      ],
      "resource_selections": [
        {
          "resource": {
            "kind": "skill",
            "id": "ask-matt"
          },
          "selected": true,
          "role": "root",
          "dependency_chain": [
            {
              "kind": "skill",
              "id": "ask-matt"
            }
          ]
        },
        {
          "resource": {
            "kind": "instruction",
            "id": "example-guidance"
          },
          "selected": false,
          "role": "unselected",
          "dependency_chain": []
        }
      ],
      "resources": [
        {
          "resource": {
            "kind": "skill",
            "id": "ask-matt"
          },
          "role": "root",
          "dependency_chain": [
            {
              "kind": "skill",
              "id": "ask-matt"
            }
          ],
          "readiness": {
            "configured": {
              "state": "known",
              "value": true
            },
            "authorized": {
              "state": "unknown",
              "value": null
            },
            "usable": {
              "state": "unknown",
              "value": null
            }
          },
          "projection_summary": {
            "verified": 1,
            "missing": 0,
            "drifted": 0,
            "ambiguous": 0,
            "unmanaged": 0
          },
          "blockers": []
        }
      ],
      "activation_role": "explicit",
      "consumers": [],
      "lifecycle_state": "active"
    }
  ],
  "focused_resource": {
    "resource": {
      "kind": "skill",
      "id": "ask-matt"
    },
    "role": "root",
    "dependency_chain": [
      {
        "kind": "skill",
        "id": "ask-matt"
      }
    ],
    "readiness": {
      "configured": {
        "state": "known",
        "value": true
      },
      "authorized": {
        "state": "unknown",
        "value": null
      },
      "usable": {
        "state": "unknown",
        "value": null
      }
    },
    "projection_summary": {
      "verified": 1,
      "missing": 0,
      "drifted": 0,
      "ambiguous": 0,
      "unmanaged": 0
    },
    "blockers": []
  },
  "requirement": {
    "resource": {
      "kind": "skill",
      "id": "ask-matt"
    },
    "readiness": "usable",
    "satisfied": false
  }
}
